{
  "alert_id": "alr_16c30a8e77a7d8d22648d24c",
  "ts": 1792286223000,
  "severity": "medium",
  "type": "cve_assessed",
  "decoy_id": "dcy-demo-1",
  "attempt_id": "att_5d0c1e8a2b7f40c19e63aa01",
  "summary": "We assess attempts on foiled/demo-app/1.0.0 as CVE-2099-0001 (tier promoted from possible to likely)",
  "links": [
    {
      "kind": "attempt",
      "href": "/attempts/att_5d0c1e8a2b7f40c19e63aa01"
    },
    {
      "kind": "queue_item",
      "href": "/review-queue/rq_1b2c3d4e"
    }
  ],
  "cve_id": "CVE-2099-0001",
  "subject": "CVE-2099-0001"
}
