{
  "alert_id": "alr_9318d12a14ff76c2da7008af",
  "ts": 1792285324000,
  "severity": "high",
  "type": "vuln_path_hook_fired",
  "decoy_id": "dcy-demo-1",
  "attempt_id": "att_5d0c1e8a2b7f40c19e63aa01",
  "summary": "Hook demo-app.upload-path-traversal fired on decoy dcy-demo-1 from 203.0.113.7 (FOILED-DEMO-0001)",
  "links": [
    {
      "kind": "attempt",
      "href": "/attempts/att_5d0c1e8a2b7f40c19e63aa01"
    },
    {
      "kind": "decoy",
      "href": "/decoys/dcy-demo-1"
    }
  ],
  "src_ip": "203.0.113.7",
  "cve_id": "FOILED-DEMO-0001"
}
