{
  "alert_id": "alr_ae9a2c010830e5da5f433054",
  "ts": 1792285923000,
  "severity": "critical",
  "type": "canary_used",
  "decoy_id": "dcy-demo-1",
  "attempt_id": "att_5d0c1e8a2b7f40c19e63aa01",
  "summary": "Canary vt-canary-env-api-key planted in dcy-demo-1 generation 12 was used from 198.51.100.23",
  "links": [
    {
      "kind": "attempt",
      "href": "/attempts/att_5d0c1e8a2b7f40c19e63aa01"
    },
    {
      "kind": "decoy",
      "href": "/decoys/dcy-demo-1"
    }
  ],
  "src_ip": "198.51.100.23"
}
